<?xml version="1.0" encoding="UTF-8"?>
<!DOCTYPE tienda SYSTEM "estudiantes.dtd">
<estudiantes>
    <estudiante id="001" genero="F">
        <nombre>Ana García</nombre>
        <edad>20</edad>
        <carrera>Ingeniería</carrera>
    </estudiante>
    <estudiante id="002" genero="M">
        <nombre>Juan Pérez</nombre>
        <edad>22</edad>
        <carrera>Medicina</carrera>
    </estudiante>
</estudiantes>